user_code,denial_code,description,suggested_action
CO,105,Service exceeds mineral therapy limitation,Review mineral therapy-specific coverage restrictions
PI,264,Service requires stress genomics report,Complete required stress genomics report first
OA,78,Invalid code clearance,Update code clearance to current standards
CR,82,Medicare CCM plan primary,Submit to Medicare CCM plan first
PR,157,Patient coverage under gamma ray therapy management,Contact gamma ray therapy management program
CO,106,Service exceeds herbal therapy limitation,Review herbal therapy-specific coverage restrictions
PI,265,Service requires meditation genomics report,Complete required meditation genomics report first
OA,79,Invalid code permission,Update code permission to current standards
CR,83,Medicare TCM plan primary,Submit to Medicare TCM plan first
PR,158,Patient coverage under proton therapy management,Contact proton therapy management program
CO,107,Service exceeds botanical therapy limitation,Review botanical therapy-specific coverage restrictions
PI,266,Service requires mindfulness genomics report,Complete required mindfulness genomics report first
OA,80,Invalid code consent,Update code consent to current standards
CR,84,Medicare BHI plan primary,Submit to Medicare BHI plan first
PR,159,Patient coverage under neutron therapy management,Contact neutron therapy management program
CO,108,Service exceeds homeopathic therapy limitation,Review homeopathic therapy-specific coverage restrictions
PI,267,Service requires yoga genomics report,Complete required yoga genomics report first
OA,81,Invalid code agreement,Update code agreement to current standards
CR,85,Medicare CCM plan primary,Submit to Medicare CCM plan first
PR,160,Patient coverage under carbon ion therapy management,Contact carbon ion therapy management program
CO,109,Service exceeds naturopathic therapy limitation,Review naturopathic therapy-specific coverage restrictions
PI,268,Service requires tai chi genomics report,Complete required tai chi genomics report first
OA,82,Invalid code contract,Update code contract to current standards
CR,86,Medicare TCM plan primary,Submit to Medicare TCM plan first
PR,161,Patient coverage under heavy ion therapy management,Contact heavy ion therapy management program
CO,110,Service exceeds ayurvedic therapy limitation,Review ayurvedic therapy-specific coverage restrictions
PI,269,Service requires qigong genomics report,Complete required qigong genomics report first
OA,83,Invalid code covenant,Update code covenant to current standards
CR,87,Medicare BHI plan primary,Submit to Medicare BHI plan first
PR,162,Patient coverage under boron neutron capture therapy management,Contact boron neutron capture therapy management program
CO,111,Service exceeds traditional Chinese medicine therapy limitation,Review traditional Chinese medicine therapy-specific coverage restrictions
PI,270,Service requires acupuncture genomics report,Complete required acupuncture genomics report first
OA,84,Invalid code pledge,Update code pledge to current standards
CR,88,Medicare CCM plan primary,Submit to Medicare CCM plan first
PR,163,Patient coverage under fast neutron therapy management,Contact fast neutron therapy management program
CO,112,Service exceeds traditional Indian medicine therapy limitation,Review traditional Indian medicine therapy-specific coverage restrictions
PI,271,Service requires chiropractic genomics report,Complete required chiropractic genomics report first
OA,85,Invalid code promise,Update code promise to current standards
CR,89,Medicare TCM plan primary,Submit to Medicare TCM plan first
PR,164,Patient coverage under slow neutron therapy management,Contact slow neutron therapy management program
CO,113,Service exceeds traditional African medicine therapy limitation,Review traditional African medicine therapy-specific coverage restrictions
PI,272,Service requires massage genomics report,Complete required massage genomics report first
OA,86,Invalid code commitment,Update code commitment to current standards
CR,90,Medicare BHI plan primary,Submit to Medicare BHI plan first
PR,165,Patient coverage under thermal neutron therapy management,Contact thermal neutron therapy management program
CO,114,Service exceeds traditional Native American medicine therapy limitation,Review traditional Native American medicine therapy-specific coverage restrictions
PI,273,Service requires reflexology genomics report,Complete required reflexology genomics report first
OA,87,Invalid code obligation,Update code obligation to current standards
CR,91,Medicare CCM plan primary,Submit to Medicare CCM plan first
PR,166,Patient coverage under epithermal neutron therapy management,Contact epithermal neutron therapy management program
CO,115,Service exceeds traditional European medicine therapy limitation,Review traditional European medicine therapy-specific coverage restrictions
PI,274,Service requires aromatherapy genomics report,Complete required aromatherapy genomics report first
OA,88,Invalid code duty,Update code duty to current standards
CR,92,Medicare TCM plan primary,Submit to Medicare TCM plan first
PR,167,Patient coverage under hyperthermal neutron therapy management,Contact hyperthermal neutron therapy management program
CO,116,Service exceeds traditional Middle Eastern medicine therapy limitation,Review traditional Middle Eastern medicine therapy-specific coverage restrictions
PI,275,Service requires hydrotherapy genomics report,Complete required hydrotherapy genomics report first
OA,89,Invalid code responsibility,Update code responsibility to current standards
CR,93,Medicare BHI plan primary,Submit to Medicare BHI plan first
PR,168,Patient coverage under hypothermal neutron therapy management,Contact hypothermal neutron therapy management program
CO,117,Service exceeds traditional South American medicine therapy limitation,Review traditional South American medicine therapy-specific coverage restrictions
PI,276,Service requires thermotherapy genomics report,Complete required thermotherapy genomics report first
OA,90,Invalid code accountability,Update code accountability to current standards
CR,94,Medicare CCM plan primary,Submit to Medicare CCM plan first
PR,169,Patient coverage under isothermal neutron therapy management,Contact isothermal neutron therapy management program
CO,118,Service exceeds traditional Australian medicine therapy limitation,Review traditional Australian medicine therapy-specific coverage restrictions
PI,277,Service requires cryotherapy genomics report,Complete required cryotherapy genomics report first
OA,91,Invalid code liability,Update code liability to current standards
CR,95,Medicare TCM plan primary,Submit to Medicare TCM plan first
PR,170,Patient coverage under adiabatic neutron therapy management,Contact adiabatic neutron therapy management program
CO,119,Service exceeds traditional Pacific Islander medicine therapy limitation,Review traditional Pacific Islander medicine therapy-specific coverage restrictions
PI,278,Service requires phototherapy genomics report,Complete required phototherapy genomics report first
OA,92,Invalid code answerability,Update code answerability to current standards
CR,96,Medicare BHI plan primary,Submit to Medicare BHI plan first
PR,171,Patient coverage under isentropic neutron therapy management,Contact isentropic neutron therapy management program
CO,120,Service exceeds traditional Arctic medicine therapy limitation,Review traditional Arctic medicine therapy-specific coverage restrictions
PI,279,Service requires magnetotherapy genomics report,Complete required magnetotherapy genomics report first
OA,93,Invalid code amenability,Update code amenability to current standards
CR,97,Medicare CCM plan primary,Submit to Medicare CCM plan first
PR,172,Patient coverage under isobaric neutron therapy management,Contact isobaric neutron therapy management program
CO,121,Service exceeds traditional Antarctic medicine therapy limitation,Review traditional Antarctic medicine therapy-specific coverage restrictions
PI,280,Service requires electrotherapy genomics report,Complete required electrotherapy genomics report first
OA,94,Invalid code susceptibility,Update code susceptibility to current standards
CR,98,Medicare TCM plan primary,Submit to Medicare TCM plan first
PR,173,Patient coverage under isochoric neutron therapy management,Contact isochoric neutron therapy management program
CO,122,Service exceeds traditional Desert medicine therapy limitation,Review traditional Desert medicine therapy-specific coverage restrictions
PI,281,Service requires ultrasound therapy genomics report,Complete required ultrasound therapy genomics report first
OA,95,Invalid code vulnerability,Update code vulnerability to current standards
CR,99,Medicare BHI plan primary,Submit to Medicare BHI plan first
PR,174,Patient coverage under isometric neutron therapy management,Contact isometric neutron therapy management program
CO,123,Service exceeds traditional Mountain medicine therapy limitation,Review traditional Mountain medicine therapy-specific coverage restrictions
PI,282,Service requires laser therapy genomics report,Complete required laser therapy genomics report first
OA,96,Invalid code exposure,Update code exposure to current standards
CR,100,Medicare CCM plan primary,Submit to Medicare CCM plan first
PR,175,Patient coverage under isotonic neutron therapy management,Contact isotonic neutron therapy management program
CO,124,Service exceeds traditional Forest medicine therapy limitation,Review traditional Forest medicine therapy-specific coverage restrictions
PI,283,Service requires infrared therapy genomics report,Complete required infrared therapy genomics report first
OA,97,Invalid code risk,Update code risk to current standards
CR,101,Medicare TCM plan primary,Submit to Medicare TCM plan first
PR,176,Patient coverage under isoelectric neutron therapy management,Contact isoelectric neutron therapy management program
CO,125,Service exceeds traditional Ocean medicine therapy limitation,Review traditional Ocean medicine therapy-specific coverage restrictions
PI,284,Service requires ultraviolet therapy genomics report,Complete required ultraviolet therapy genomics report first
OA,98,Invalid code hazard,Update code hazard to current standards
CR,102,Medicare BHI plan primary,Submit to Medicare BHI plan first
PR,177,Patient coverage under isomagnetic neutron therapy management,Contact isomagnetic neutron therapy management program
CO,126,Service exceeds traditional River medicine therapy limitation,Review traditional River medicine therapy-specific coverage restrictions
PI,285,Service requires X-ray therapy genomics report,Complete required X-ray therapy genomics report first
OA,99,Invalid code peril,Update code peril to current standards
CR,103,Medicare CCM plan primary,Submit to Medicare CCM plan first
PR,178,Patient coverage under isoelectric neutron therapy management,Contact isoelectric neutron therapy management program
CO,127,Service exceeds traditional Lake medicine therapy limitation,Review traditional Lake medicine therapy-specific coverage restrictions
PI,286,Service requires gamma ray therapy genomics report,Complete required gamma ray therapy genomics report first
OA,100,Invalid code danger,Update code danger to current standards
CR,104,Medicare TCM plan primary,Submit to Medicare TCM plan first
